{
  "task_id": "FQV2-001",
  "source_ref": "docs/superpowers/specs/2026-06-02-flange-qc-v2-gate-resolution-design.md",
  "owner_agent": "codex_developer",
  "qa_agent": "codex_qa",
  "preferred_lane": "codex",
  "branch": "agent/fqv2-001-app-skeleton",
  "allowed_paths": [
    "apps/flange_qc_v2/**",
    "tests/flange_qc_v2/**",
    "tests/test_product_ci_config.py",
    ".ai-factory/product-ci.json",
    ".ai-factory/gates/flange_qc_v2_fqv2_001_dor.json",
    ".ai-factory/qa/flange_qc_v2_*",
    "docs/project/flange_qc_v2/**",
    "docs/adr/flange-qc-v2/ADR-0005-bootstrap-repo-app-root-and-branch-convention.md",
    "docs/superpowers/plans/2026-06-02-flange-qc-v2-gate-resolution-and-skeleton.md"
  ],
  "restricted_paths": [
    ".env",
    "machine_vision/**",
    "legacy runtime",
    "factory datasets",
    "model weights",
    "TensorRT engines",
    "production deploy",
    "secrets",
    "destructive migrations"
  ],
  "acceptance_criteria": [
    "App package imports without camera, GPU, model, factory data, or approved product specs.",
    "Health endpoint returns explicit subsystem states.",
    "Unknown production capabilities are reported as unavailable, not passing.",
    "No SOP PASS/NG production decision logic is implemented.",
    "Product CI is enabled with checks that pass in this repo."
  ],
  "test_commands": [
    "python3 -m unittest discover -s tests/flange_qc_v2 -v",
    "python3 -m compileall -q apps/flange_qc_v2 tests/flange_qc_v2",
    "python3 scripts/product-ci/run_product_checks.py",
    "python3 -m unittest discover -s tests -v"
  ],
  "handoff_required": true,
  "rollback_note": "Revert FQV2-001 branch changes to remove the app skeleton and restore disabled product CI."
}
